{
  "schema_version": "1.0",
  "cycle_id": "20260420-1000-kde-stale-binary",
  "ran_at": "2026-04-20T18:00:00Z",
  "samples": [
    {"sample_id": "COLO829", "metric_value": 0.005, "ci_lower": null, "ci_upper": null, "p_value": null, "passed_threshold": true},
    {"sample_id": "HCC1395", "metric_value": -0.019, "ci_lower": null, "ci_upper": null, "p_value": null, "passed_threshold": true},
    {"sample_id": "HCC1395_DORADO", "metric_value": -0.025, "ci_lower": null, "ci_upper": null, "p_value": null, "passed_threshold": true},
    {"sample_id": "HCC1954", "metric_value": 0.001, "ci_lower": null, "ci_upper": null, "p_value": null, "passed_threshold": true},
    {"sample_id": "H1437", "metric_value": -0.008, "ci_lower": null, "ci_upper": null, "p_value": null, "passed_threshold": true},
    {"sample_id": "H2009", "metric_value": 0.012, "ci_lower": null, "ci_upper": null, "p_value": null, "passed_threshold": true},
    {"sample_id": "HCC1937", "metric_value": 0.022, "ci_lower": null, "ci_upper": null, "p_value": null, "passed_threshold": true}
  ],
  "consistency": {
    "n_samples_passed": 7,
    "n_samples_total": 7,
    "direction_consistency": "7/7 bias < 3% post-KDE-fix (vs pre-fix bias range -17.6% to +158.6%)",
    "wilcoxon_p": null,
    "fisher_combined_p": null,
    "confidence_uplift": 0.85
  },
  "fan_out_mode": "sequential",
  "verdict": "consistent"
}
